{
  "_doc": "Promocion Silver — eventos_current: append_dedup desde Bronze",
  "name":        "eventos_current",
  "description": "Append Dedup de eventos_raw hacia eventos_current",
  "ingest_type": "batch",
  "strategy":    "append_dedup",
  "enabled":     true,

  "source": { "format": "delta" },

  "source_contract":      "../../tables/bronze/eventos_raw.json",
  "destination_contract": "../../tables/silver/eventos_current.json",

  "merge_keys":    ["evento_id"],

  "metadata": {
    "add_silver_timestamps": true
  }
}
