{
  "_doc": "Promocion Silver — alertas_current: append_dedup desde Bronze",
  "name":        "alertas_current",
  "description": "Append Dedup de alertas_raw hacia alertas_current",
  "ingest_type": "batch",
  "strategy":    "append_dedup",
  "enabled":     true,

  "source": { "format": "delta" },

  "source_contract":      "../../tables/bronze/alertas_raw.json",
  "destination_contract": "../../tables/silver/alertas_current.json",

  "merge_keys":    ["alerta_id"],

  "metadata": {
    "add_silver_timestamps": true
  }
}
