{
  "_doc": "Promocion Silver — clientes_current: full_merge desde Bronze",
  "name":        "clientes_current",
  "description": "Full Merge de clientes_raw hacia clientes_current",
  "ingest_type": "batch",
  "strategy":    "full_merge",
  "enabled":     true,

  "source": { "format": "delta" },

  "source_contract":      "../../tables/bronze/clientes_raw.json",
  "destination_contract": "../../tables/silver/clientes_current.json",

  "merge_keys":    ["cliente_id"],

  "metadata": {
    "add_silver_timestamps": true
  }
}
